headline,story-content
U.S. Lags in Global Measure of Premature Births,"Fifteen million babies are born prematurely each year, and the United States fared badly in the first country-by-country global comparison of premature births, which was released Wednesday by the World Health Organization and other agencies.Although American hospitals excel at saving premature infants, the United States is similar to developing countries in the percentage of mothers who give birth before their children are due, the study’s chief author noted. It does worse than any Western European country and considerably worse than Japan or the Scandinavian countries.That stems from the unique American combination of many pregnant teenagers and many women older than 35 who are giving birth, sometimes to twins or triplets implanted after in vitro fertilization, the authors said. Twins and triplets are often deliberately delivered early by Caesarean section to avoid the unpredictable risks of vaginally delivering multiple full-term babies.Also, many American women of childbearing age have other risk factors for premature birth, like obesity, diabetes, high blood pressure or smoking habits. And the many women who lack health insurance often do not see doctors early in their pregnancies, when problems like high blood pressure or genital infections can be headed off.Experts do not know all the elements that can set off early labor.Seeing similar problems simultaneously in Africa and the United States “is really a tale of two planets,” said Dr. Joy Lawn, director of global policy for Save the Children and the report’s chief author.The report, three years in the making, is the first to compare premature birthrates in 184 countries. It was produced jointly by the W.H.O., Save the Children, the March of Dimes and the Partnership for Maternal, Newborn and Child Health, which has more than 400 member organizations. Other contributors include nearly 40 major American, European and United Nations health and foreign aid agencies and foundations.The report’s conclusions about the United States are similar to those in a 2009 report by the federal government, which found that high rates of premature birth are the main reason this country has infant mortality rates higher than those of other wealthy countries. Very poor countries have high rates of premature births for different reasons: women have many babies, adolescent girls become pregnant at even earlier ages, and infections that can prompt early labor are more common.Nine of the 11 countries in which 15 percent or more of all births are preterm are in Africa; the other two are Pakistan and Indonesia.The United States shares the 12 percent range with Kenya, Turkey, Thailand, East Timor and Honduras, meaning one in nine births is early. The rate in the United States has risen 30 percent since 1981.Most European countries, Canada and Australia are in the 7- to 9-percent range.While agreeing that the United States does poorly compared with Europe, Dr. Alan E. Guttmacher, director of the National Institute of Child Health and Human Development, took issue with equating it to Africa.African data is shakier, said Dr. Guttmacher, who read a draft of the report. Also, he said, the report counts only premature births, not stillbirths. In this country, a fetus in danger is delivered early, a practice that raises the preterm birth count, while in much of Africa, the infant would die and not be counted.Premature infants are, of course, much more likely to die in poor countries.In the United States, an infant born before 28 weeks has a 90 percent chance of surviving, though often with disabilities, while in most of Africa such a child has a 90 percent chance of dying, according to the report.(The report defines full-term as 39 weeks; other authorities use 37 to 40 weeks.)After pneumonia, complications of premature birth are the second-highest cause of death in infants, the report said. More than 60 percent of the 1.1 million babies who die of such birth complications every year are in Africa or South Asia.Many could be easily and cheaply saved, the report said.Steroid injections for mothers in early labor, which help develop immature fetal lungs and cost only $1, could save almost 400,000 lives a year.Teaching “kangaroo care” — wrapping the baby against the mother’s chest to keep it warm and promote breast-feeding — could save an additional 450,000.Wiping first-aid cream on the stump of the umbilical cord and having antibiotics on hand to fight pneumonia would save more lives, the report said.The report took years to produce because there is no global database, Dr. Lawn said, and many countries measure pregnancies differently — by the baby’s weight or the mother’s last period, for example.The spread of ultrasound machines has made measurement more accurate, she said.Because the triggers for premature labor are not fully understood, the poor performance by the United States is partly a mystery, Dr. Guttmacher said. “This underscores the need for more research,” he said.In his study of 2,100 Mexican-Americans and immigrants from Mexico, Dr. Radek K. Bukowski, an expert on preterm birth at the University of Texas Medical Branch in Galveston, found that the longer a woman lived in this country, the greater her chances of giving birth prematurely. The risk was 4 percent for recent immigrants, 7 percent for those living here less than a decade and 10 percent for citizens.Even after controlling for risk factors like age, poverty, smoking, obesity and diabetes, “we really don’t have an explanation for what’s behind it,” Dr. Bukowski said. “But whatever it is, it’s not genetic. It’s something they acquire here.”And Dr. Gordon C. S. Smith, an expert in the same field at the University of Cambridge, noted that his native Scotland had many of the same risk factors as the United States — teenage pregnancies, poverty, obesity and older mothers — and yet had much lower rates.“If somebody had a simple explanation of why the U.K. and Europe do much better, I wouldn’t believe them,” Dr. Smith said. “The reality is, for most preterm births, we just don’t understand the cause.”The report singled out some countries for reducing their rates of premature birth. Croatia, Ecuador and Estonia improved rapidly, Dr. Lawn said. Croatia was easy to explain: a war ended. The other two countries became wealthier and used some of that wealth to saving babies’ lives.The report also praised Turkey and Sri Lanka for cutting their rates rapidly. Sri Lanka made sure pregnant women were visited frequently by trained midwives. Turkey even paid rural women to go to hospitals to give birth and created “maternity homes” where they waited out their pregnancies’ final days."
"Island's Genetic Quirk: Dark Skin, Blond Hair","In the Solomon Islands, about 10 percent of the dark-skinned indigenous people have strikingly blond hair. Some islanders theorize that the coloring could be a result of excess sun exposure, or a diet rich in fish. Another explanation is that the blondness was inherited from distant ancestors — European traders and explorers who came to the islands.But that’s not the case, researchers now report. The gene variant responsible for blond hair in the islanders is distinctly different from the gene that causes blond hair in Europeans.“For me it breaks down any kind of simple notions you might have about race,” said Carlos Bustamante, a geneticist at Stanford University. “Humans are beautifully diverse, and this is just the tip of the iceberg.”Dr. Bustamante and his colleagues published their findings in the current issue of the journal Science.The researcher analyzed saliva samples from more than 1,000 islanders, looking closely at a subset of the samples — from 43 blond and 42 dark-haired islanders.They were soon able to identify the single gene responsible for the variance in hair color. Called TYRP1, the gene is known to influence pigmentation in humans.The researchers also found that the variant of TYRP1 that causes blond hair in Solomon Islanders is absent in Europeans’ genomes.“Here you go into an unstudied population with a small sample size and you can really find some cool things,” Dr. Bustamante said. “So what about other places, like what about light pigmentation in parts of Africa? How do we not know the genetic basis of skin and hair pigmentations across the globe?”He and his team hope to raise more money to further analyze the Solomon Islands data."
"'Ome,' the Sound of the Scientific Universe Expanding","The age of “omes” is here. It began with the genome, continued with the proteome, branched out with the memome and reached full flowering with the notion of the omome.This probably sounds like raw material for nonsense poetry, but it’s a real biological and linguistic trend that makes sense, once you get the idea of just what an “ome” is.The genome is the place to start. It is the totality of all the genes, whether in an organism or in something else, like a tumor. The human genome, mapped out about a decade ago, includes all the genes that make a human being.Creating a map of the whole genome was a monumental achievement, and during work on that project and after its completion, the omification of science took off. Joshua Lederberg, a geneticist and Nobel laureate who died in 2008, and Alexa T. McCray, now an associate professor at Harvard Medical School, saw it coming, and talked about the origin of the suffix “ome” in a 2001 essay, “ ’Ome Sweet ’Omics — A Genealogical Treasury of Words,” in The Scientist.The word “genome” was first used in 1920, by Hans Winkler, a German scientist, to mean all the material on the chromosomes in a sperm or egg, but did not become really popular until the end of the last century, when genome mapping began. Various experts had differing ideas on where the suffix came from, but it seems to be one that was made up. In any case, it clearly meant the totality of something. Dr. Lederberg, who coined a few scientific terms himself, contributed “microbiome” — all the microbes that live in and on humans — to the growing trend.An epidemic of neologia ensued. Thus were born the proteome and the secretome and the glycome, and numerous other omes that are pretty much impossible to keep track of. Interactome. Regulome. Connectome. Epigenome. The list goes on. In fact, it goes on for about 18 pages if you go to the Omics.org site and print out its list of omes and omics.The list could be said to be the omome, the ome of all the omes, a word which, in a moment of indulgent fantasy, I thought perhaps I had invented. Apparently not. “Omome,” or “omeome,” is on the Omics.org list, although the Web site given as a source led nowhere. Another possible inventor is Martin Krzywinski, a scientist at the Genome Sciences Center in Vancouver, British Columbia. He has created some extraordinary visual representations of genomes, and also invents new words. Among the coinings he offers on his site are “omome,” “omeomics,” “omicsophy,” which I don’t think will ever take off, and, just Thursday, “metaomomics,” which I don’t even want to think about.I loved the idea of the omome, but I thought it needed a reality check. I called Mark Gerstein at Yale. His lab is deeply involved in bioinformatics, the use of computing to make sense of the vast amounts of information produced in pursuit of the various omes. Dr. Gerstein also has an interest in the way scientific terminology develops.The omome, he said, was a fun idea, but he doubted anyone was making a living in omomics. Despite the humor in speculative omification, he said, the proliferation of real omic disciplines marked the spread of a “very important scientific idea.” He said, “All the omes derive to some extent from the genome,” and key to all of them is that an ome represents “the entirety of the thing being studied.”The mapping of genomes, he said, inspired scientists to use the same approach in studying proteins, metabolites and their biochemical connections, to name a few. And as they pursued this “omic idea,” the focus of biological research shifted in the direction of studying complete systems and networks, rather than individual parts, discrete genes or proteins.His comments reminded me of a recent conversation I had when I was reporting on the evolution of polar bears. One scientist wanted to make it clear to me that she was studying genomics, whereas another researcher was studying only genes. Only genes, I thought? What a difference an ome can make."
"Island’s Genetic Quirk: Dark Skin, Blond Hair","In the Solomon Islands, about 10 percent of the dark-skinned indigenous people have strikingly blond hair. Some islanders theorize that the coloring could be a result of excess sun exposure, or a diet rich in fish. Another explanation is that the blondness was inherited from distant ancestors — European traders and explorers who came to the islands.But that’s not the case, researchers now report. The gene variant responsible for blond hair in the islanders is distinctly different from the gene that causes blond hair in Europeans.“For me it breaks down any kind of simple notions you might have about race,” said Carlos Bustamante, a geneticist at Stanford University. “Humans are beautifully diverse, and this is just the tip of the iceberg.”Dr. Bustamante and his colleagues published their findings in the current issue of the journal Science.The researcher analyzed saliva samples from more than 1,000 islanders, looking closely at a subset of the samples — from 43 blond and 42 dark-haired islanders.They were soon able to identify the single gene responsible for the variance in hair color. Called TYRP1, the gene is known to influence pigmentation in humans.The researchers also found that the variant of TYRP1 that causes blond hair in Solomon Islanders is absent in Europeans’ genomes.“Here you go into an unstudied population with a small sample size and you can really find some cool things,” Dr. Bustamante said. “So what about other places, like what about light pigmentation in parts of Africa? How do we not know the genetic basis of skin and hair pigmentations across the globe?”He and his team hope to raise more money to further analyze the Solomon Islands data."
"‘Ome,’ the Sound of the Scientific Universe Expanding","The age of “omes” is here. It began with the genome, continued with the proteome, branched out with the memome and reached full flowering with the notion of the omome.This probably sounds like raw material for nonsense poetry, but it’s a real biological and linguistic trend that makes sense, once you get the idea of just what an “ome” is.The genome is the place to start. It is the totality of all the genes, whether in an organism or in something else, like a tumor. The human genome, mapped out about a decade ago, includes all the genes that make a human being.Creating a map of the whole genome was a monumental achievement, and during work on that project and after its completion, the omification of science took off. Joshua Lederberg, a geneticist and Nobel laureate who died in 2008, and Alexa T. McCray, now an associate professor at Harvard Medical School, saw it coming, and talked about the origin of the suffix “ome” in a 2001 essay, “ ’Ome Sweet ’Omics — A Genealogical Treasury of Words,” in The Scientist.The word “genome” was first used in 1920, by Hans Winkler, a German scientist, to mean all the material on the chromosomes in a sperm or egg, but did not become really popular until the end of the last century, when genome mapping began. Various experts had differing ideas on where the suffix came from, but it seems to be one that was made up. In any case, it clearly meant the totality of something. Dr. Lederberg, who coined a few scientific terms himself, contributed “microbiome” — all the microbes that live in and on humans — to the growing trend.An epidemic of neologia ensued. Thus were born the proteome and the secretome and the glycome, and numerous other omes that are pretty much impossible to keep track of. Interactome. Regulome. Connectome. Epigenome. The list goes on. In fact, it goes on for about 18 pages if you go to the Omics.org site and print out its list of omes and omics.The list could be said to be the omome, the ome of all the omes, a word which, in a moment of indulgent fantasy, I thought perhaps I had invented. Apparently not. “Omome,” or “omeome,” is on the Omics.org list, although the Web site given as a source led nowhere. Another possible inventor is Martin Krzywinski, a scientist at the Genome Sciences Center in Vancouver, British Columbia. He has created some extraordinary visual representations of genomes, and also invents new words. Among the coinings he offers on his site are “omome,” “omeomics,” “omicsophy,” which I don’t think will ever take off, and, just Thursday, “metaomomics,” which I don’t even want to think about.I loved the idea of the omome, but I thought it needed a reality check. I called Mark Gerstein at Yale. His lab is deeply involved in bioinformatics, the use of computing to make sense of the vast amounts of information produced in pursuit of the various omes. Dr. Gerstein also has an interest in the way scientific terminology develops.The omome, he said, was a fun idea, but he doubted anyone was making a living in omomics. Despite the humor in speculative omification, he said, the proliferation of real omic disciplines marked the spread of a “very important scientific idea.” He said, “All the omes derive to some extent from the genome,” and key to all of them is that an ome represents “the entirety of the thing being studied.”The mapping of genomes, he said, inspired scientists to use the same approach in studying proteins, metabolites and their biochemical connections, to name a few. And as they pursued this “omic idea,” the focus of biological research shifted in the direction of studying complete systems and networks, rather than individual parts, discrete genes or proteins.His comments reminded me of a recent conversation I had when I was reporting on the evolution of polar bears. One scientist wanted to make it clear to me that she was studying genomics, whereas another researcher was studying only genes. Only genes, I thought? What a difference an ome can make."
Scientist Sentenced in French Terror Case,"PARIS — A Paris court on Friday sentenced a French-Algerian particle physicist to five years in prison, one of them suspended, on the charge of “criminal association with the intent to prepare terrorist acts,” ruling that the man’s online correspondence in 2009 with a presumed member of Al Qaeda constituted a criminal act.The scientist, Adlène Hicheur, 35, did not deny the exchange of messages, in which he suggested targets for terrorist strikes in France, but maintains that he never intended to act on his words. The trial has raised difficult questions about the possible excesses of French antiterrorism law, which in effect treats intent as a criminal act.A researcher at the Large Hadron Collider project at CERN, the European Organization for Nuclear Research, in Switzerland, Dr. Hicheur met his interlocutor on an Internet forum dedicated to radical Islam while on sick leave, nursing a herniated disk at his parents’ home in southeastern France.Dr. Hicheur has been in prison since his arrest 2 1/2 years ago; that period will be counted as time served, his lawyer said Friday, adding that they would decide in coming days whether to appeal the verdict.Judicial authorities say French law allows them to intervene while apparent terrorist plots remain in the planning stages. Dr. Hicheur’s supporters, by contrast, contend that the legislation oversteps the bounds of civil rights, that matters of pure intent should not reach the courts, which they call ill suited to plumb the vagaries of the human psyche.Dr. Hicheur, it has been widely noted, never acted on his words — he purchased no weapons and offered no direct assistance.“This decision seems to me to constitute a veritable judicial scandal,” said Dr. Hicheur’s lawyer, Patrick Baudouin, after Friday’s verdict. “It’s in light of simple words exchanged that Adlène Hicheur finds himself condemned to this sentence,” Mr. Baudouin said, without the “slightest beginning of a start” to terrorist acts.Over three decades, hundreds of people have been convicted and jailed on charges of “criminal association,” though Dr. Hicheur’s appears to be the first conviction based solely on Internet activity, Mr. Baudouin said.Dr. Hicheur was born in Algeria and has been described as an observant Muslim who integrated in French society but was angered by the wars in Iraq and Afghanistan, as well as the Israeli-Palestinian conflict. He was employed by the Laboratory for High Energy Physics at the École Polytechnique Fédérale de Lausanne, with an office at CERN, where he was involved in work on antimatter, in an effort to explain why the universe is made of matter and not its opposite. Colleagues viewed him as a talented researcher.James Gillies, a spokesman for CERN, said in an e-mail that the laboratory did not interfere in the affairs of its member nations, but that “CERN remains committed to its policy of inclusion.”In 2009, Dr. Hicheur exchanged about three dozen messages, some of them encrypted, with a man French officials have identified as Mustapha Debchi, a representative in Algeria of Al Qaeda’s regional affiliate, Al Qaeda in the Islamic Maghreb. Dr. Hicheur maintains that he never knew the man’s identity, as the messages were exchanged via online pseudonyms, he under the name “Abou Doujana,” the other man under the name “Phenixshadow.”In a message in June 2009, the man inquired: “Are you disposed to work in an operative unit in France?”“Yes, of course,” Dr. Hicheur replied, though he repeatedly hedged, never committing to any specific plan, according to Mr. Baudouin.During a two-day trial in March, Dr. Hicheur acknowledged that while his e-mail correspondence might appear troubling, it was the fruit of intellectual curiosity and not the aspirational writings of a budding jihadi. He was on morphine at the time, and passing through a “turbulent patch,” he told the court, according to news reports.“I can understand that certain passages might cause worry,” he said, though he never explicitly repudiated their content.Dr. Hicheur’s brother Halim, a physiology researcher in Grenoble, France, criticized the case. He said “All this has been scandalous and outrageous from the beginning to the end.”Asked whether Dr. Hicheur would try to resume his physics career, his brother Halim said he did not know, but doubted that it was a realistic prospect in France.The directors of France’s national police and domestic intelligence agency accuse the physicist of planning an attack at the base of a French Alpine infantry battalion that has been deployed in Afghanistan.“The target was chosen — we had to intervene,” the police director, Frédéric Péchenard, told the newspaper Le Monde shortly after Dr. Hicheur’s arrest.In a sharply worded column in Le Monde earlier in the week, several of Dr. Hicheur’s supporters, including his former doctoral adviser, contested that assertion, and denounced the trial as absurd.“With a bit of perseverance, soon we will realize that the most harmless virtual forums are filled with unpunished criminal intentions,” they wrote mockingly.Defending the legitimacy of the case in a 2011 letter to a support committee for Dr. Hicheur, a top Justice Ministry official insisted that France’s antiterrorism legislation strikes the “necessary balance” between “the procedural guarantees of a State of Law” and the “imperatives of protection for its citizens.”Charges of “criminal association,” first defined in legislation dating from 1986, are central to the functioning of French antiterrorism efforts, judicial authorities say.“It’s a redoubtable tool,” said the antiterrorism magistrate Marc Trévidic, in an interview last year.Standards for admissible evidence are lower in France than in the United States, Mr. Trévidic noted. Wiretaps and other surveillance are far more common and easily authorized, as well, allowing authorities to build cases that might be impossible elsewhere.Mr. Trévidic acknowledged, however, that the system “can produce abuses.”Nor is it fail-safe. In March, just days before Dr. Hicheur’s trial, police commandos in Toulouse killed Mohammed Merah, the 23-year-old self-proclaimed jihadi who killed seven people in a series of shootings that month.Like Dr. Hicheur, Mr. Merah had been under surveillance by French intelligence."
