headline,story-content
Assumptions and Attitudes Don’t Survive Cancer,"MALIGNANT Medical Ethicists Confront Cancer.By Rebecca Dresser.272 pages. Oxford University Press. $29.95.MEMOIR OF A DEBULKED WOMAN Enduring Ovarian CancerBy Susan Gubar.288 pages. Norton. $24.95.Health care is supposed to move in only one direction, from horizontal to vertical, bed to door. The staunchly upright caretakers who wave the traffic along are not supposed to crumple backward into bed themselves, and when they do, no one is more surprised than they are.Doctors who become ill have written about the emotional whiplash of the experience so often that the “had I but known” theme has grown a little old. Two new books bring some welcome variation: Many other professionals spend their workdays focused on the body, and even those who don’t actually perform hands-on care may find precious assumptions demolished by serious illness.Ethicists are medicine’s theoreticians; some are primarily scholars, while others head right onto hospital wards as a combination of critic, coach and umpire. They come to know the terminology of illness and the perils of treatment very well, and because insoluble clinical problems are their daily fodder, they have rehearsed the standard “if this ever happens to me” scenario as often as anyone.Still, nothing prepares anyone for the horizontal experience, as seven medical ethicists discovered when they or a spouse received a diagnosis of cancer. They were so collectively shaken that they formed a discussion group, and then, like good academics, turned the proceedings into a book.Rebecca Dresser, editor of “Malignant,” is a professor of law and medical ethics at Washington University in St. Louis and a survivor of oral cancer. As an ethicist, she has a firm professional commitment to patient autonomy, the doctrine of “it’s your body and you alone decide what happens to it”. As a patient, she got herself into serious trouble wielding that autonomy: Unable to eat or drink, she firmly refused a feeding tube until she almost starved to death. Finally, her caretakers strong-armed her into changing her mind, and she eventually made a full and grateful recovery.As director of the bioethics program at the University of Wisconsin, Dr. Norman Fost regularly deplores our national pastime of wasteful and unnecessary medical testing. Yet as a patient, he writes, he has personally benefited enormously from just such testing, with not one, not two but three separate serious illnesses diagnosed with entirely unwarranted tests, leaving him with a bad case of what he calls “hypocrite’s guilt.”Dan Brock, the philosopher who directs the division of medical ethics at Harvard Medical School, learned he had prostate cancer at age 63, neither young enough nor old enough to simplify the many choices in the management of that disease. As an ethicist, Dr. Brock deplores old-style medical paternalism (the doctor orders, the patient obeys). As a patient, he was confused about treatment options, and none of his “good, nonpaternalistic doctors” pushed for any particular one. The resulting uncertainty was “the hardest part of the whole business,” he writes.It is hardly news that theory sometimes falls apart in practice, but the seven contributors to this volume reweave the threads of the ideal and the real into a set of earnest, readable reflections. One might be tempted to conclude that it represents a pinnacle of academic writing, were its well-mannered achievements not so roundly bested by the next book on the shelf.That is Susan Gubar’s staggering, searing “Memoir of a Debulked Woman.” Ms. Gubar may not be a health professional, but as a noted feminist critic (she is an author of the influential 1970s classic “Madwoman in the Attic”), she has certainly spent a career immersed in the meaning and functions of the female body. In one of those inexplicably savage medical ironies, she was felled in her early 60s by the worst of the “female” diseases: ovarian cancer. As is common, it had spread throughout her abdomen by the time of diagnosis.Cases like Ms. Gubar’s are usually first treated with the surgical removal of as much cancer as possible, along with all dispensable abdominal organs that are affected or at risk. This is the “debulking” of her title, and it is about as close to evisceration as civilians can experience. It became her focal metaphor for the experience of sudden dire illness, as all other interests drop away save “an overriding and offensive obsession with one’s own physical vulnerability.” On a less literary note, the procedure winds up bringing her almost more physical grief than the cancer itself.Ms. Gubar moves back and forth between poet and patient, with the occasional sidestep into academic mode as she reviews writing by women affected with similar illness. It is a difficult and potentially cringe-making project.But even the most skeptical and finicky reader — even the healthy reader, even the healthy male reader — will not put this book down. Some of its appeal comes from Ms. Gubar’s skill with textual analysis, and some from various appealing verbal shenanigans (has anyone else found and pondered the “mother” in chemotherapy, for instance?). Most gripping, though, is her frank, courageous account of life with a horrific postoperative infection in her large intestine that came to involve the buttock area.You don’t find infections like this one on slick, ultrasanitized “hospital” TV or in purported tell-all memoirs. You do, of course, find them in real life. Ms. Gubar deserves the highest admiration for her bravery and honesty as she bangs down yet one more door in her career — even if, sadly, it belongs to a place she had not wanted or intended to enter."
Spring&#8217;s False Start,"Q. After a late-winter warm spell that was followed by early-spring cold, I noticed that the trees in my neighborhood did not fully blossom. Even crab apple blossoms perished in the cold. What can we expect by summer?A. Plants are very resilient and should not suffer long-term damage from such weather patterns, said Mark Fisher, director of horticulture at Brooklyn Botanic Garden — though he added that if fruit-tree flowers die off, there will be a missing fruit crop.“It is not uncommon for us in a normal spring to have warm days followed by cool days,” he said. “A cold snap following warm weather will just slow things down.”One thing that could potentially cause long-term harm, Mr. Fisher said, is snow, which can break leafy branches and kill new growth.For that reason, he said, “our native trees are slower to leaf out — just to be on the safe side and protect themselves from this situation.”Another seasonal threat to the fruit crop, Mr. Fisher said, is that in rainy springs, when trees bloom in sustained wet conditions, “pollination is impacted, because bees and many other common pollinators don’t like the rain.”    C. CLAIBORNE RAY "
E.R. Doctors Face Quandary on Painkillers,"Dr. Bruce Lobitz, an attending physician in the emergency department at Upstate Carolina Medical Center in Gaffney, S.C., sees about 10 patients a week complaining of toothaches. “The bane of our existence,” he calls them.It’s not just that doctors like him lack the training and tools to solve their dental problems. Many of these patients, he fears, complain of tooth pain simply as a ruse to get prescriptions for narcotics.“Almost all dental patients request a prescription for narcotic pain pills,” Dr. Lobitz said. “ ‘I just need something to tide me over until I can see a dentist’ — that’s the classic line.” Sometimes, drug-seekers will show their cards: “They’ll say they’re allergic to everything except Vicodin.”Dental patients — mostly uninsured or indigent — are not unusual in emergency rooms. Poor patients may forgo preventive care and delay treatment until they face a medical crisis. In many states, adult dental benefits under Medicaid, the government insurance program for the poor, have been scaled back or eliminated. And dentists often don’t accept Medicaid patients.But emergency physicians like Dr. Lobitz cannot know whether someone who claims to be in agony from dental issues is telling the truth — or simply plans, he said, to “go to the next emergency room, next town over, and get another 30 Vicodin.”Dr. Gail D’Onofrio, chairwoman of the emergency medicine department at Yale School of Medicine, has studied alcohol and drug abuse in emergency rooms. “The overuse of narcotics is a huge problem, and when a patient presents, especially for dental pain, it’s difficult to make an objective assessment,” she said. “It puts the physician in a difficult situation to assess whether or not someone truly needs pain medications. We err on the side of treating pain, and it is a huge potential for abuse.”The frequent prescription of narcotics in emergency departments for dental pain has been quantified for the first time by research financed by the National Institutes of Health, bringing to light another way opioids get into circulation and contribute to the rampant abuse of painkillers in the United States.From 1997 to 2007, painkillers were prescribed in three of four visits to the emergency department for dental complaints; roughly half of visits resulted in a prescription for antibiotics, according to a new analysis of the National Hospital Ambulatory Medical Care Survey by Dr. Christopher Okunseri, a practicing dentist and an associate professor of public health at the Marquette University School of Dentistry in Milwaukee.Over that period, the number of painkiller prescriptions for dental patients in emergency departments rose 26 percent, and antibiotic prescriptions jumped 41 percent, according to the report, published online in January in the journal Medical Care.“E.D. doctors don’t have the training or expertise to provide definitive care, so the easy way out for them is medication,” Dr. Okunseri said. “If you’re not careful, you’ll create more addicts.”In interviews, many emergency department doctors acknowledged that they write plenty of prescriptions for opioids for patients complaining of dental pain, but they feel they face a conundrum. “I admit that some people get drugs out of me who shouldn’t get them,” said Dr. Tom Benzoni, an emergency physician who has worked for 18 years at Mercy Medical Center in Sioux City, Iowa.Yet some patients are genuinely in pain. “Do I deny them drugs so that one person doesn’t get a little more Vicodin?” he said. “It’s emptying the ocean with a teacup to try to address our societal drug problem.”Time pressures and heavy patient loads leave doctors with few choices. “If your goal is to get people out of the emergency room, it’s about stabilizing and shipping out,” said Dr. Nathaniel Katz, the director of the nonprofit Program on Opioid Risk Management at the Tufts Health Care Institute. “What’s the easiest way to get patients shipped out? Write them a prescription for Vicodin. How long does that take?”Dr. Katz, a neurologist and pain specialist, added that emergency department doctors lack the tools, like dental X-ray machines, to determine whether, for example, a tooth’s nerve is infected, an excruciating problem that often requires root canal or extraction.Relatively few emergency department workers are trained to give dental blocks, local anesthetic injections that offer immediate relief for 6 to 16 hours. In theory, the injections reduce the number of dental patients who leave the emergency room with potentially habit-forming narcotics.Dr. Rita K. Cydulka, the vice chairwoman of the emergency medicine department at MetroHealth Medical Center in Cleveland, offers dental blocks, but she said that others in her specialty don’t want to take the time. “They find it easier to write a script for antibiotics and painkillers, and send people on their way,” she said.Before writing a prescription, few emergency doctors use drug-monitoring programs to see whether patients have recently been given painkillers. Forty states have these programs and eight have enacted legislation to create them, said John Eadie, director of the Prescription Monitoring Program Center of Excellence at Brandeis University.“Unfortunately many emergency physicians don’t realize the importance of a quick check of the database to see how many painkiller prescriptions a patient has filled lately,” he said.During the first half of 2010, just one of 12 monitoring programs that reported to the Center for Excellence had 100 percent of prescribers registered to use their data. In the other states, the percentage of prescribers registered was only 9 percent to 39 percent, Mr. Eadie said.Some doctors say the many pressures they face create other incentives to quickly prescribe remedies for patients complaining of severe pain. For example, doctors are often rated by their hospitals with patient-satisfaction surveys for how they treat pain.“You can be faulted for not treating a patient’s pain — it’s considered the ‘fifth vital sign,’ ” said Dr. Abhi Mehrotra, the assistant director of the emergency medicine department at the University of North Carolina Hospitals. “We have to ask a patient’s pain, on a scale of 0 to 10, as well as document a reassessment of their pain after treatment.”Dr. Benzoni, who is routinely rated on patient satisfaction and sometimes asked by management to explain a bad review, said that he feels at times as if he faces a no-win choice. “If you’re going to criticize me for not giving out narcotics, and you never praise me for correctly identifying a drug-seeker,” he said, “then I’m going to give out narcotics.”"
Signs of Volcanoes In Mars Topography,"A new study suggests that the Athabasca Valles, a group of valleys near the Martian equator, were not formed by ice, as some scientists have theorized.Instead, high-resolution images of the valleys reveal more than 250 coiling spiral patterns that closely resemble lava flows on the Big Island of Hawaii. And that means the valleys on Mars were probably formed by volcanic activity, said Andrew J. Ryan, the planetary scientist at Arizona State University who discovered the coils.Mr. Ryan, a first-year doctoral student, reported the findings in the journal Science, along with his colleague Philip R. Christensen, also a planetary scientist at Arizona State.The Hawaiian coils were produced by a shearing effect, in which lava flows at different speeds and in different directions. It is likely that something similar happened on Mars, Mr. Ryan said.The coils may also have been formed through a spreading process like the one that produces oceanic crust. In that process, magma solidifies into a crust that slowly spreads outward, like two conveyor belts moving in opposite directions, Mr. Ryan said. A coil can form in the spreading center.Mr. Ryan said he suspected both volcanic processes had been at work on Mars, though he added, “In some areas shearing alone might have caused coil formation.”"
Abuse of Opiates Soars in Pregnant Women,"The fast-growing abuse of prescription drugs has reached maternity wards in hospitals across the country, with the number of pregnant women addicted to opiate drugs — and the number of babies born experiencing withdrawal symptoms — rising sharply over the last decade.A new study in The Journal of the American Medical Association has quantified the growth of the problem for the first time, as well as the increase in the costs of treating these newborns.The study estimated that every hour a baby is born in the United States with symptoms of withdrawal from opiates — roughly 13,500 babies a year. The condition, known as neonatal abstinence syndrome, can cause seizures, breathing problems, dehydration, difficulty feeding, tremors and irritability. Many infants are hospitalized for several weeks while doctors treat them with methadone or morphine to gradually wean them from their dependence on the drugs that their mothers used.“The incidence has gone crazy and I think it has the potential to become a national or international issue,” said Marie J. Hayes, a clinical neuroscientist at the University of Maine, and an author of an editorial accompanying the study. “People who previously might not have used heroin or the needle are more likely to use prescription opiates.”It is unclear whether babies exposed to opiates in the womb will experience long-term consequences. In the 1980s, there was alarm over whether babies born to cocaine-addicted mothers would suffer developmental problems or other damaging effects, but studies later showed that such problems were far from certain and much more likely if the child had to contend with economic hardship, family instability, poor education and other factors.The new study looked at two large databases that included a representative sample of patients from across the country and found that the number of pregnant mothers using opiate drugs jumped fivefold from 2000 to 2009. The number of infants with neonatal abstinence syndrome nearly tripled in the same period. The average cost of taking care of each infant climbed to $53,400 from $39,400, adjusted for inflation. Medicaid paid for more than three-quarters of the cases, since many of the women were low-income.“These babies require a tremendous amount of nursing care,” said Dr. Mark Hudak, chairman of pediatrics at the University of Florida College of Medicine in Jacksonville and an author of new guidelines on neonatal abstinence syndrome issued by the American Academy of Pediatrics this year.Infants in the study spent an average of 16 days in the hospital, usually in neonatal intensive care units, which are especially expensive because of the specialized nursing care. Since 2000, the length of time infants spend in the hospital has not decreased, suggesting that doctors have not yet learned how to make treatment for withdrawal more efficient, said Dr. Stephen Patrick, an author of the study and a neonatologist in the University of Michigan Health System.“Are there other places in the hospital that can treat them?” like standard pediatric wards or outpatient clinics, Dr. Patrick asked. “Are there different medications or ways to treat them?”Dr. Hudak recommends trying to soothe babies first by cuddling them and placing them in darkened rooms. If that is unsuccessful, the newborns are given methadone, morphine or another drug related to what the baby was exposed to in utero; the drug is tapered off gradually until the baby is weaned. That process requires careful monitoring. “These drugs are very easy to overdose babies with,” Dr. Hudak said. “There have been deaths.” And if babies are weaned too soon, “they can wind up getting rehospitalized.”Still, despite the risks, studies suggest it is more effective to give the babies a drug related to what their mothers were taking, rather than just treating the symptoms of the babies’ withdrawal — seizures and breathing problems, for example, said Hendrée E. Jones, a Johns Hopkins University researcher in psychiatry and behavioral sciences.But the experts agreed that the best approach is to deal with women’s drug addictions before they are pregnant."
Simple Device Helps Delay Birth to Lift Babies’ Chances of Survival,"In wealthy countries, some very premature babies are saved in intensive care units. In poor countries, they often die or develop blindness, retardation, lung problems or cerebral palsy.Now a new study has found that in women at high risk of premature birth, a pessary — a small silicon collar placed around the neck of the cervix (as seen on ultrasound, above) — may delay birth until a newborn has a greater chance of survival.It also appears affordable, at least in middle-income countries, since pessaries cost less than $50 each and could be made cheaply if demand was greater. Placing one normally requires an ultrasound scan, but ultrasound machines are fairly common in hospitals and clinics in all but the poorest countries.The study, published in The Lancet last month, was the first randomized trial of pessaries for this purpose.Various pessary designs have been around for centuries, usually to prevent the uterus from prolapsing into the vagina or causing stress incontinence.For this trial, doctors at five Spanish hospitals divided in half a group of 385 women, all of whom had cervixes less than an inch long, which put them at high risk for early labor. Only 6 percent of the women who got pessaries give birth prematurely, compared with 27 percent of those who did not get them.Exactly why pessaries delay labor is unclear. In an editorial, The Lancet said the study raises the “novel and exciting possibility” that the load-bearing capacities of pelvic organs are important in pregnancy and starting labor."
"In Birds’ Pursuit of Love, New Plant Life Blooms","Male bowerbirds cultivate plants, a new study reports, though their gardening work appears to be unintentional.The birds, found in Australia and Papua New Guinea, are named for the extravagant structures they build to woo females. As part of their courting strategy, they decorate these bowers with fruits, and the seeds of these fruits germinate. This results in new plants of the species Solanum ellipticum, also known as the potato bush.“On average you find about 40 plants where bowers are,” eight times as many as at random sites, said Joah R. Madden, an evolutionary biologist at the University of Exeter in England.The findings appear in the journal Current Biology.The researchers found that the birds were not picking areas with high plant concentrations to build their bowers, since the plants began to appear after their arrival.“These plants are arriving after the bowerbirds,” Dr. Madden said. “In a sense the male is cultivating them.”It appears to be an excellent symbiotic relationship, he said. When the birds build their bowers, they clear the area around them, creating ideal growing conditions for the plants.“When we look around bowers, only 30 percent is covered with grass, shrubs, compared to random sites, where’s there about 50 percent,” Dr. Madden said.And male bowerbirds surrounded by more plants had more success with mating.Curiously, males seem to cultivate a duller, grayer version of the fruit; fruits grown farther from bowers were a more yellowish green.Dr. Madden isn’t sure why. “Presumably because that’s what the female wants,” he said."
Best-Case Scenario: Two Chances to Mate,"Male orb-web spiders have an unenviable lot. Most of the time, their mates eat them immediately after copulating. Even if that doesn’t happen, males can mate at most twice in one lifetime.Now, a study of mating behavior in one species of orb-web spiders has revealed interesting patterns of male monogamy.“Males mate with a female a second time if she is very heavy and a virgin,” said Klaas Welke, a behavioral biologist at the University of Hamburg in Germany who led the research. “This was quite important to them.”Mr. Welke, a doctoral student, and his colleagues report their findings in the journal Frontiers in Zoology.The researchers studied a species known as Argiope bruennichi that lives in Europe, from the Mediterranean up to Scandinavia. Eighty percent of the time, females are successful in cannibalizing their mate during his first copulation.“Heavy females lay more eggs, so you have opportunity to fertilize more eggs,” Mr. Welke said.During mating, a male’s pedipalp, the organ that transfers sperm, breaks off in the female and forms a plug. This prevents subsequent males from fertilizing eggs. Each male spider has two pedipalps, allowing him to mate twice in a lifetime.When a male mates with a virgin, he is able to secure 100 percent paternity of her eggs. If she is not a virgin, paternity decreases by as much as 90 percent.The study also found connections between time of day and monogamy.Males are more likely to mate twice with the same female early in the day, Mr. Welke said. Later in the day, they tend to search for a second female to mate with."
