headline,story-content
Tumbling Creatures,"Q. I bring home fresh produce from a garden that invariably has little critters embedded, sow bugs and the like. I put them outside on my 19th-floor window ledge, and they crawl or fall away. Do they get hurt?A. Probably not, in the opinion of Ward Wheeler, head of the division of invertebrate zoology at the American Museum of Natural History.“Sow bugs are crustaceans, like shrimp, not insects,” Dr. Wheeler said. They have the advantage of reaching their top speed very quickly because of their small size, he said, “so they are likely fine.”He cited a famous 1928 essay, “On Being the Right Size,” by the biologist J. B. S. Haldane:“The resistance presented to movement by the air is proportional to the surface of the moving object. Divide an animal’s length, breadth and height each by 10; its weight is reduced to a thousandth, but its surface only to a hundredth. So the resistance to falling in the case of the small animal is relatively 10 times greater than the driving force.”Or as Haldane put it, more graphically: “You can drop a mouse down a thousand-yard mine shaft; and, on arriving at the bottom, it gets a slight shock and walks away, provided that the ground is fairly soft. A rat is killed, a man is broken, a horse splashes.”C. CLAIBORNE RAY"
Huge Asteroid Is Still the Central Villain in Dinosaurs' Extinction,"For some 30 years, scientists have debated what sealed the fate of the dinosaurs. Was an asteroid impact more or less solely responsible for the catastrophic mass extinction at the end of the Cretaceous geological period, 65 million years ago? Or were the dinosaurs already undergoing a long-term decline, and the asteroid was merely the coup de grâce?So three young researchers, led by Stephen L. Brusatte, a graduate student at Columbia University who is affiliated with the American Museum of Natural History, decided to test this hypothesis with a close examination of the fossil record over the 12 million years leading up to the mass extinction.For the study, the researchers departed from the practice of focusing almost exclusively on raw counts of the number of species over time. Instead, they analyzed changes in the anatomies and body plans of seven large groups of late Cretaceous dinosaurs for insights into their evolutionary trajectory.Groups that show an increase in variability, for example, might have been evolving into more species, giving them an ecological edge. But decreasing variability might be a warning sign of approaching doom.In science, alas, not all projects fulfill researchers’ ambitions. The findings of this one were mixed and generally inconclusive, Mr. Brusatte’s team reported in an article published online last week by the journal Nature Communications. At best, striking a positive note, the team wrote that the “calculations paint a more nuanced picture of the last 12 million years of dinosaur history.”As Mr. Brusatte explained, the late Cretaceous “wasn’t a static ‘lost world’ that was violently interrupted by an asteroid impact.” Some dinosaurs, he noted, “were undergoing dramatic changes during this time, and large herbivores seem to have been mired in a long-term decline, at least in North America.”The findings showed that duck-billed hadrosaurs and horned ceratopsids, two groups of large-bodied, bulk-feeding plant eaters (meaning they ate just about anything and everything) might have declined in diversity at this time. In contrast, small herbivores like the ankylosaurs and pachycephalosaurs, and the meat-eating tyrannosaurs and coelurosaurs, appeared to be holding steady or perhaps increasing in diversity. So, too, were the enormous herbivorous sauropods like apatosaurs.The results were not uniform on different continents. While hadrosaurs declined in North America, their diversity seemed to have been increasing in parts of Asia. The fossil record in many regions was insufficient for reliable analysis, meaning that the extinction debate will continue.Besides Mr. Brusatte, the other authors were Richard J. Butler of the University of Munich, Albert Prieto-Márquez of the Bavarian State Collection for Paleontology and Geology in Munich, and Mark A. Norell, an American Museum paleontologist who is Mr. Brusatte’s doctoral adviser.Dr. Norell said the study of skeletal changes in groups of species over time was “a novel way” to assess their prospects for survival over the long haul. “It would be nice to have more fossils to see how much these results are real,” he said.Paul C. Sereno, a paleontologist at the University of Chicago who had no part in the study, agreed that such investigations of life at the end of the Cretaceous had been “limited by the coarseness of the data where you really need it.” He questioned whether the research technique, though useful in studying simpler invertebrates, could be applied successfully to dinosaurs.“It’s an interesting study, and they are quality researchers,” Dr. Sereno said, “but I don’t think it changes the picture over all: Extinctions aren’t a simple process, but ultimately the asteroid was the major factor at the end of the Cretaceous.”"
Early Thinkers,"To the Editor:I was dismayed that “From the Minds of Babes” (May 1) did not reference the groundbreaking contributions of the Swiss child psychologist Jean Piaget (1896-1980). For over 50 years, Piaget sought to answer the same epistemological questions posed by Dr. Elizabeth S. Spelke. Piaget’s investigations into the origins of object permanence, number, geometry and time provide the foundations of Dr. Spelke’s research.In recent years, Piaget theory of cognitive stage development seems to have fallen out of favor. Thirty years ago, at any gathering of developmental or educational psychologists one would find numerous investigators presenting Piaget-based research papers. My last check of papers presented at recent American Psychological Association and the American Educational Research Association annual meetings found no mention of Piaget.Barry KaufmanOakland, Calif."
Zombie-Ant Fungus Has Its Own Killer Fungus,"Like something out of a horror movie, the zombie-ant fungus attacks and invades the brains of carpenter ants. Possessed ants march to their death, and the fungus lives inside the exoskeleton.Now, a new study reports that the zombie-ant fungus itself faces attack by another fungus.This secondary attacker, a white fungus, is “looking for its own lunch, and it thinks this dead ant is a nice thing to eat, along with the fungus that’s eating the ant,” said David Hughes, a disease biologist at Penn State and one of the authors.This attack prevents the spores of the zombie-ant fungus from spreading and infecting other ants in the colony, Dr. Hughes said.“Looking at the colony, it’s a good thing for the ants,” he said. “The enemy of my enemy is my friend.”It takes about three to nine days for ants to die after the zombie-ant fungus attacks. A month or two later, the white fungus might come along and attack the parasite growing from its remains, Dr. Hughes said.He and his colleagues studied carpenter ants in the rain forests of Brazil and southern Thailand. There are more than a thousand species of carpenter ants throughout the world.The intertwined lives of the fungi and the ants illustrate just how complex relationships are, Dr. Hughes said.This may be particularly true in rain forest settings, since there is no winter season in which food sources might diminish.“So life just becomes a nonstop hunt for lunch,” Dr. Hughes said. “We really haven’t gotten to the bottom of the complex interactions that are going on there.”The study appears in the journal PLoS One."
It's Not So Lonely at the Top: Ecosystems Thrive High in the Sky,"Looming over the northern edge of the Amazon rain forest are some of the most remarkable mountains on earth. Known as tepuis, or tabletop mountains, they are typically ringed by sheer cliffs that rise thousands of feet from the surrounding lowland jungles. Instead of peaks, tepuis have enormous flat expanses at their tops. To reach the tops of many tepuis, the only choices are scaling the cliffs or flying in a helicopter.For all their isolation, the tops of tepuis are not barren. They are like islands in the sky, covered with low forests and shrublands that support a diversity of animals likes frogs and lizards. Many of the species that live on top of the tepuis are found nowhere else on the planet.In a paper to be published in the journal Evolution, a team of scientists report the first DNA-based study to address an age-old question about the tepuis: How did animals and plants end up in such an inaccessible place?The researchers focused on tiny tree frogs that live only atop the tepuis. They came to the surprising conclusion: Over the past few million years, the frogs climbed up the colossal cliffs.“We may see those walls as being impossible for something to climb because just they’re so hard for us,” said the lead author, Patricia Salerno, an evolutionary biologist at the University of Texas. “But it is possible for these frogs to get up there. They’ve gotten up there several times.”Tepuis owe their fame in good measure to “The Lost World,” Arthur Conan Doyle’s 1912 novel, in which he drew from accounts of early explorers to imagine an isolated ecosystem on top of a tepui where dinosaurs and pterosaurs still lived. Tepuis have also figured in Hollywood movies, from the 1925 dramatization of “The Lost World” to the 2009 animated film “Up.”Some intrepid scientists scaled the tepuis to learn how they formed. Their history is very different from that of the nearby Andes, which formed like many mountain ranges do, as two continental plates collided 25 million years ago and thrust rock layers upward.The tepuis are far older. The highest layers of rock were formed by sand settling on the bottom of oceans more than two billion years ago. The sandstone was later lifted and become dry land. It began to erode and fragment about 300 million years ago, and by about 70 million years ago, the tepuis towered above the surrounding lowlands.Even more intriguing than the tepuis’ long isolation is that many species living atop them are found nowhere else.To many biologists, the only explanation that made sense was that the ancestors of those unique animals and plant species have lived on the tepuis for more than 70 million years. In honor of Conan Doyle, they called this notion the “lost world hypothesis.”Ms. Salerno realized that genetics offered a straightforward way to test this hypothesis. Over time, species accumulate new mutations in their DNA at a roughly regular rate. When two species diverge from a common ancestor, their DNA becomes steadily more different. Biologists can use this so-called molecular clock to estimate how long ago their common ancestor lived.Ms. Salerno decided to compare species from different tepuis to see how different their DNA had become. If the species had been on their tepuis ever since they formed, she reasoned, their common ancestor would have to be at least 70 million years old.Tree frogs would be a good group of species to study, she decided, because they move around very little during their lives. One species of tree frog found on the tepuis hides out inside one species of carnivorous plant during the day, for example, coming out only at night to hunt for insects. It’s therefore not surprising that 90 percent of frog species that live on the summits of tepuis are found nowhere else.Working with American and South American collaborators, Ms. Salerno has collected collected frog DNA from museum collections and trips to tepuis.For their study, the researchers compared the DNA from four closely related species of tree frogs, each found on a different tepui. They also analyzed the DNA of their closest lowland relatives.Ms. Salerno and her colleagues found that the frogs evolved long after the dinosaurs. The common ancestor of all four tepui frog species lived about 5.3 million years ago, not 70 million years ago. Some of the species diverged only a few hundred thousand years ago.“This is the first effort to get a feeling for the evolutionary aspects of this thing, and in that sense it’s a step forward,” said Roy McDiarmid, a herpetologist at the Smithsonian. He finds it plausible that the tree frogs scaled the tepuis only in the past few million years.But he doesn’t think a study on one group of frogs rules out the “lost world” hypothesis for other species. His own studies on toads, for example, suggest that they have been living on top of the tepuis since they formed. To see if he’s right, he’d like to be able to analyze their DNA as well.“The problem is we don’t have a lot of data,” Dr. McDiarmid said.There may not be much time left to gather data. Global warming has been driving mountain-dwelling species to higher altitudes, and will drive them up even farther. But the frogs and other species that are found only on top of tepuis have already gone as high as they can go. “They’re just going to go extinct,” Ms. Salerno said.The tepui frogs may have been able to scale cliffs that would make mountaineers blanch. But even they can’t climb into thin air."
Turning Up the Heat on Lettuce: Lettuce and Green Garlic Soup,"Every once in a while I put out a message on the Recipes for Health Facebook page asking readers to tell me what they’re getting in their C.S.A. produce baskets, what they need recipes for. The most recent responses reflected an overabundance of lettuce. One reader replied: “Lettuce. So much lettuce. Lettuce to the point where I get a nervous tic just thinking about eating another salad.”So I decided to devote most of the recipes this week to dishes that involve cooking lettuce. I couldn’t resist one simple romaine and radish salad, but the rest of the dishes are cooked. I used the tough outer leaves of romaine or leaf lettuce in blended sauces and entire heads in soups. I tested several classic French braised lettuce recipes, but as promising as these looked on paper, they didn’t appeal to me nearly as much as the more vibrant Chinese stir-fried lettuce dishes I tried, or the puréed soups. In the French braised dishes, the life seemed to be cooked out of the lettuces.I used sturdy lettuces like romaine and leaf lettuce for the cooked dishes, not tender spring mixes, which really should be dedicated to salads. Bitter lettuces with tough outer leaves, like curly endive (a k a escarole or chicory) and Batavia, stand up to cooking the same way greens like kale do. Use the recipes not only when you have a surfeit of lettuce in your C.S.A. basket, but also for the tough outer leaves of the one head of romaine in your fridge that you don’t want to include in your salads.The only recipe this week that has a high caloric content is a bean and chicory combo, and those calories and carbs come mostly from the beans, which also contribute lots of great nutrients, like protein and fiber.Lettuce and Green Garlic SoupUse a flavorful broth – chicken or vegetable – to enhance the subtle flavors in this thick, comforting soup.1 tablespoon extra virgin olive oil1 medium onion, chopped1 bulb green garlic, stalks and papery layers removed, roughly chopped1/2 cup rice7 cups chicken or vegetable stock1/2 cup parsley leavesA bouquet garni made with a bay leaf and a few sprigs each parsley and thyme, tied togetherSalt to taste3/4 pound lettuce leaves, washed and coarsely chopped (8 cups)A generous amount of freshly ground pepper2 tablespoons chopped flat-leaf parsley or chives for garnishFreshly grated Parmesan for garnish 1. Heat the olive oil in a large, heavy soup pot over medium heat and add the onion. Cook, stirring, until it is tender, about 5 minutes. Add a generous pinch of salt and the garlic and cook, stirring, until the garlic is fragrant, about 1 minute. Add the rice, stock, parsley leaves and bouquet garni, and bring to a boil. Add the lettuce and salt to taste, reduce the heat, cover and simmer over low heat for 30 minutes. The tough ribs of the lettuce leaves should be thoroughly tender.2. Using an immersion blender or a regular blender (working in batches and covering the blender with a kitchen towel to prevent the hot soup from splashing), blend the soup until smooth. If using a regular blender, return the soup to the heat. Add lots of freshly ground pepper, taste and adjust salt. Heat through and serve, garnishing each bowl with chopped fresh parsley or chives and freshly grated Parmesan.Yield: 4 servings.Advance preparation: You can make this a day ahead, but you will probably want to thin it out a bit when you reheat it.Nutritional information per serving: 174 calories; 4 grams fat; 1 gram saturated fat; 1 gram polyunsaturated fat; 3 grams monounsaturated fat; 0 milligrams cholesterol; 29 grams carbohydrates; 3 grams dietary fiber; 60 milligrams sodium (does not include salt to taste); 7 grams proteinMartha Rose Shulman is the author of “The Very Best of Recipes for Health.”  "
A Crocodile Too Huge To Fit on the Family Tree,"Giant crocodiles, far larger than any known to date, lived in Kenya two million to four million years ago among our human ancestors, according to a new report.A fossil of one specimen, 27 feet in length, shows that it is not closely related to the Nile crocodile, as some scientists had thought, said Christopher A. Brochu, a vertebrate paleontologist at the University of Iowa and the new study’s first author.Although the two crocodiles look similar, the ancient species has a different skull and jaw formation from the Nile crocodile.“There’s this misconception that crocodiles are these living fossils that haven’t changed,” he said. “This is something different, a species of a true crocodile, but different from anything known.”Dr. Brochu and his colleagues published their report in a recent issue of The Journal of Vertebrate Paleontology. Their findings mean that the origins of the Nile crocodile remain a bit of a mystery.Although crocodiles are ancient, they have evolved considerably over time. Today there are about three to five species of crocodiles in Africa, but in ancient times there may been twice as many, Dr. Brochu said.“This would have been a major part of the life our ancestors,” he said. “If there is something in the water that can swallow you whole, then you’re going to think about to how to approach the water.”"
Preserving Marine Life,"To the Editor:“Life in the Sea Found Its Fate in a Paroxysm of Extinction” (May 1) explains that ocean acidification and other factors drove a mass extinction, wiping out 95 percent of marine species. It’s even more startling that we’re now changing ocean chemistry even faster.Unless we reduce carbon dioxide emissions, ocean pH will change by 70 percent by 2050. Changing ocean chemistry is already hurting local economies. We must start now to avoid the next great extinction — the one set to begin in our lifetime.Andrew SharplessWashingtonThe writer is chief executive, Oceana."
